{"$schema":"../schemas/device-ui-template-v2.schema.json","schemaVersion":2,"id":"ir-clocks-premium-modern","name":"Modern Clock Remote","deviceTypeId":"clocks","connections":["infrared"],"renderer":"declarative","access":"premium","columns":4,"useFullWidth":true,"backgroundMode":"vertical-gradient","backgroundColor":"#111019","backgroundColor2":"#27213A","foregroundColor":"#FFF9FF","surfaceColor":"#29213C","accentColor":"#C8A8FF","buttonColor":"#382F4D","buttonTextColor":"#FFFFFF","borderColor":"#66547F","buttonCornerRadius":18,"sectionCornerRadius":22,"buttonHeight":56,"groups":[{"id":"clock","name":"Clock","order":10,"columnSpan":4,"controls":[{"id":"power","type":"button","label":"POWER","command":"Power","row":0,"column":0},{"id":"mode","type":"button","label":"MODE","command":"Mode","row":0,"column":1},{"id":"set","type":"button","label":"SET","command":"Set","row":0,"column":2},{"id":"light","type":"button","label":"LIGHT","command":"Light","row":0,"column":3},{"id":"hour-down","type":"button","label":"HOUR −","command":"HourDown","row":1,"column":0},{"id":"hour-up","type":"button","label":"HOUR +","command":"HourUp","row":1,"column":1},{"id":"minute-down","type":"button","label":"MIN −","command":"MinuteDown","row":1,"column":2},{"id":"minute-up","type":"button","label":"MIN +","command":"MinuteUp","row":1,"column":3}]},{"id":"alarm","name":"Alarm & Sleep","order":20,"columnSpan":4,"controls":[{"id":"alarm1","type":"button","label":"ALARM 1","command":"Alarm1","row":0,"column":0,"columnSpan":2},{"id":"alarm2","type":"button","label":"ALARM 2","command":"Alarm2","row":0,"column":2,"columnSpan":2},{"id":"sleep","type":"button","label":"SLEEP","command":"Sleep","row":1,"column":0,"columnSpan":2},{"id":"snooze","type":"button","label":"SNOOZE","command":"Snooze","row":1,"column":2,"columnSpan":2}]}]}