{"$schema":"../schemas/device-ui-template-v2.schema.json","schemaVersion":2,"id":"ir-speaker-premium-modern","name":"Modern Speaker Remote","deviceTypeId":"speaker","connections":["infrared"],"renderer":"declarative","access":"premium","columns":4,"useFullWidth":true,"backgroundMode":"vertical-gradient","backgroundColor":"#0B0B0E","backgroundColor2":"#25232A","foregroundColor":"#FFFFFF","surfaceColor":"#2B2930","accentColor":"#E0B16C","buttonColor":"#3B3841","buttonTextColor":"#FFFFFF","borderColor":"#665F6B","buttonCornerRadius":18,"sectionCornerRadius":22,"buttonHeight":58,"groups":[{"id":"audio","name":"Speaker","order":10,"columnSpan":4,"controls":[{"id":"power","type":"button","label":"POWER","command":"Power","row":0,"column":0},{"id":"source","type":"button","label":"SOURCE","command":"Source","row":0,"column":1,"columnSpan":2},{"id":"mute","type":"button","label":"MUTE","command":"Mute","row":0,"column":3},{"id":"vol-down","type":"button","label":"VOLUME −","command":"VolumeDown","row":1,"column":0,"columnSpan":2},{"id":"vol-up","type":"button","label":"VOLUME +","command":"VolumeUp","row":1,"column":2,"columnSpan":2}]},{"id":"sound","name":"Sound","order":20,"columnSpan":4,"controls":[{"id":"bass-down","type":"button","label":"BASS −","command":"BassDown","row":0,"column":0},{"id":"bass-up","type":"button","label":"BASS +","command":"BassUp","row":0,"column":1},{"id":"treble-down","type":"button","label":"TREBLE −","command":"TrebleDown","row":0,"column":2},{"id":"treble-up","type":"button","label":"TREBLE +","command":"TrebleUp","row":0,"column":3},{"id":"music","type":"button","label":"MUSIC","command":"Music","row":1,"column":0},{"id":"movie","type":"button","label":"MOVIE","command":"Movie","row":1,"column":1},{"id":"voice","type":"button","label":"VOICE","command":"Voice","row":1,"column":2},{"id":"night","type":"button","label":"NIGHT","command":"Night","row":1,"column":3}]}]}