{
 "$schema":"../schemas/device-ui-template-v2.schema.json","schemaVersion":2,"id":"ir-av-receiver-premium-modern","name":"Modern AV Receiver Remote","deviceTypeId":"av-receiver","connections":["infrared"],"renderer":"declarative","access":"premium","columns":4,"useFullWidth":true,"horizontalSpacing":8,"verticalSpacing":10,"screenMarginLeft":12,"screenMarginTop":12,"screenMarginRight":12,"screenMarginBottom":18,"backgroundMode":"vertical-gradient","backgroundColor":"#0B0D12","backgroundColor2":"#171B24","foregroundColor":"#F7F8FA","mutedTextColor":"#A8AFBD","surfaceColor":"#1A1F29","accentColor":"#FF9F43","buttonColor":"#242B37","buttonTextColor":"#FFFFFF","borderColor":"#3A4352","buttonCornerRadius":16,"sectionCornerRadius":20,"buttonHeight":56,"buttonFontSize":13,"groups":[
 {"id":"main","name":"Receiver","titlePlacement":"border","order":10,"columnSpan":4,"shape":"rounded","cornerRadius":20,"borderColor":"#3A4352","borderWidth":1,"backgroundColor":"#171C25","controls":[{"id":"power","order":10,"type":"button","label":"POWER","command":"Power","row":0,"column":0,"columnSpan":2,"backgroundColor":"#C53D50","textColor":"#FFFFFF","fontAttribute":"bold"},{"id":"mute","order":20,"type":"button","label":"MUTE","command":"Mute","row":0,"column":2,"columnSpan":2,"backgroundColor":"#6B531D","textColor":"#FFF2BE","fontAttribute":"bold"}]},
 {"id":"volume","name":"Volume","titlePlacement":"border","order":20,"columnSpan":4,"shape":"rounded","cornerRadius":22,"borderColor":"#4B4031","borderWidth":1,"backgroundColor":"#1B1C20","controls":[{"id":"vol-down","order":10,"type":"button","label":"−","command":"VolumeDown","row":0,"column":0,"columnSpan":2,"height":68,"backgroundColor":"#303640","fontSize":28},{"id":"vol-up","order":20,"type":"button","label":"+","command":"VolumeUp","row":0,"column":2,"columnSpan":2,"height":68,"backgroundColor":"#B86A23","textColor":"#FFFFFF","fontSize":28,"fontAttribute":"bold"}]},
 {"id":"sources","name":"Sources","titlePlacement":"border","order":30,"columnSpan":4,"shape":"rounded","cornerRadius":20,"borderColor":"#3A4352","borderWidth":1,"backgroundColor":"#171C25","controls":[{"id":"tv","order":10,"type":"button","label":"TV","command":"TV","row":0,"column":0,"backgroundColor":"#273444"},{"id":"bd","order":20,"type":"button","label":"BD/DVD","command":"BDDVD","row":0,"column":1,"backgroundColor":"#273444"},{"id":"game","order":30,"type":"button","label":"GAME","command":"Game","row":0,"column":2,"backgroundColor":"#273444"},{"id":"aux","order":40,"type":"button","label":"AUX","command":"AUX","row":0,"column":3,"backgroundColor":"#273444"},{"id":"hdmi1","order":50,"type":"button","label":"HDMI 1","command":"HDMI1","row":1,"column":0,"columnSpan":2,"backgroundColor":"#314154"},{"id":"hdmi2","order":60,"type":"button","label":"HDMI 2","command":"HDMI2","row":1,"column":2,"columnSpan":2,"backgroundColor":"#314154"}]},
 {"id":"sound","name":"Sound","titlePlacement":"border","order":40,"columnSpan":4,"shape":"rounded","cornerRadius":20,"borderColor":"#3A4352","borderWidth":1,"backgroundColor":"#171C25","controls":[{"id":"sound-mode","order":10,"type":"button","label":"SOUND MODE","command":"SoundMode","row":0,"column":0,"columnSpan":2,"backgroundColor":"#4B365C"},{"id":"surround","order":20,"type":"button","label":"SURROUND","command":"Surround","row":0,"column":2,"columnSpan":2,"backgroundColor":"#4B365C"},{"id":"bass-down","order":30,"type":"button","label":"BASS −","command":"BassDown","row":1,"column":0,"backgroundColor":"#29313C"},{"id":"bass-up","order":40,"type":"button","label":"BASS +","command":"BassUp","row":1,"column":1,"backgroundColor":"#29313C"},{"id":"menu","order":50,"type":"button","label":"MENU","command":"Menu","row":1,"column":2,"backgroundColor":"#29313C"},{"id":"info","order":60,"type":"button","label":"INFO","command":"Info","row":1,"column":3,"backgroundColor":"#29313C"}]}
 ]
}
