{"$schema":"../schemas/device-ui-template-v2.schema.json","schemaVersion":2,"id":"ir-air-purifier-premium-modern","name":"Modern Air Purifier Remote","deviceTypeId":"air-purifier","connections":["infrared"],"renderer":"declarative","access":"premium","columns":4,"useFullWidth":true,"horizontalSpacing":8,"verticalSpacing":11,"backgroundMode":"vertical-gradient","backgroundColor":"#071214","backgroundColor2":"#0D2528","foregroundColor":"#F0FEFF","accentColor":"#45D6D0","buttonColor":"#17383A","buttonTextColor":"#F0FEFF","borderColor":"#2A5A5D","buttonCornerRadius":20,"buttonHeight":58,"groups":[{"id":"main","name":"Air Purifier","titlePlacement":"border","order":10,"columnSpan":4,"backgroundColor":"#102C2E","cornerRadius":24,"controls":[{"type":"button","label":"POWER","command":"Power","row":0,"column":0,"backgroundColor":"#C2424F","fontAttribute":"bold"},{"type":"button","label":"AUTO","command":"Auto","row":0,"column":1,"columnSpan":2,"backgroundColor":"#167D7A","fontAttribute":"bold"},{"type":"button","label":"MODE","command":"Mode","row":0,"column":3},{"type":"button","label":"FAN +","command":"FanSpeedUp","row":1,"column":0,"columnSpan":2},{"type":"button","label":"FAN −","command":"FanSpeedDown","row":1,"column":2,"columnSpan":2}]},{"id":"comfort","name":"Comfort","titlePlacement":"border","order":20,"columnSpan":4,"backgroundColor":"#0E292B","cornerRadius":20,"controls":[{"type":"button","label":"SLEEP","command":"Sleep","row":0,"column":0,"columnSpan":2,"backgroundColor":"#273A55"},{"type":"button","label":"QUIET","command":"Quiet","row":0,"column":2,"columnSpan":2,"backgroundColor":"#263B48"},{"type":"button","label":"IONIZER","command":"Ionizer","row":1,"column":0,"columnSpan":2},{"type":"button","label":"DISPLAY","command":"Display","row":1,"column":2,"columnSpan":2}]},{"id":"maintenance","name":"Timer & Filter","titlePlacement":"border","order":30,"columnSpan":4,"backgroundColor":"#0E292B","cornerRadius":18,"controls":[{"type":"button","label":"TIMER","command":"Timer","row":0,"column":0,"columnSpan":2},{"type":"button","label":"FILTER RESET","command":"FilterReset","row":0,"column":2,"columnSpan":2,"backgroundColor":"#51492A"}]}]}