{"$schema":"../schemas/device-ui-template-v2.schema.json","schemaVersion":2,"id":"ir-fireplaces-premium-modern","name":"Modern Fireplace Remote","deviceTypeId":"fireplaces","connections":["infrared"],"renderer":"declarative","access":"premium","columns":4,"useFullWidth":true,"horizontalSpacing":8,"verticalSpacing":11,"backgroundMode":"vertical-gradient","backgroundColor":"#160B08","backgroundColor2":"#2B1510","foregroundColor":"#FFF4EA","accentColor":"#FF8A45","buttonColor":"#43241B","buttonTextColor":"#FFF4EA","borderColor":"#71402E","buttonCornerRadius":20,"buttonHeight":58,"groups":[{"id":"main","name":"Fireplace","titlePlacement":"border","order":10,"columnSpan":4,"backgroundColor":"#321A14","cornerRadius":24,"controls":[{"type":"button","label":"POWER","command":"Power","row":0,"column":1,"columnSpan":2,"backgroundColor":"#B64232","fontAttribute":"bold","fontSize":16},{"type":"button","label":"FLAME +","command":"FlameUp","row":1,"column":0,"columnSpan":2,"backgroundColor":"#A64F27"},{"type":"button","label":"FLAME −","command":"FlameDown","row":1,"column":2,"columnSpan":2,"backgroundColor":"#71361F"}]},{"id":"heat","name":"Heat","titlePlacement":"border","order":20,"columnSpan":4,"backgroundColor":"#2C1712","cornerRadius":20,"controls":[{"type":"button","label":"HEAT","command":"Heat","row":0,"column":0,"columnSpan":2,"backgroundColor":"#8C3528"},{"type":"button","label":"MODE","command":"Mode","row":0,"column":2,"columnSpan":2},{"type":"button","label":"TEMP +","command":"TemperatureUp","row":1,"column":0,"columnSpan":2},{"type":"button","label":"TEMP −","command":"TemperatureDown","row":1,"column":2,"columnSpan":2}]},{"id":"ambience","name":"Ambience","titlePlacement":"border","order":30,"columnSpan":4,"backgroundColor":"#291611","cornerRadius":20,"controls":[{"type":"button","label":"COLOR","command":"FlameColor","row":0,"column":0,"columnSpan":2,"backgroundColor":"#673C27"},{"type":"button","label":"BRIGHTNESS","command":"FlameBrightness","row":0,"column":2,"columnSpan":2,"backgroundColor":"#77472C"},{"type":"button","label":"TIMER","command":"Timer","row":1,"column":0,"columnSpan":2},{"type":"button","label":"SLEEP","command":"Sleep","row":1,"column":2,"columnSpan":2}]}]}