{"$schema":"../schemas/device-ui-template-v2.schema.json","schemaVersion":2,"id":"ir-cd-player-premium-modern","name":"Modern CD Player Remote","deviceTypeId":"cd-player","connections":["infrared"],"renderer":"declarative","access":"premium","columns":4,"useFullWidth":true,"backgroundMode":"vertical-gradient","backgroundColor":"#090D14","backgroundColor2":"#172333","foregroundColor":"#F7FAFF","surfaceColor":"#152437","accentColor":"#68AFFF","buttonColor":"#20354E","buttonTextColor":"#FFFFFF","borderColor":"#35577A","buttonCornerRadius":17,"sectionCornerRadius":22,"buttonHeight":56,"groups":[{"id":"deck","name":"CD Deck","order":10,"columnSpan":4,"controls":[{"id":"power","type":"button","label":"POWER","command":"Power","row":0,"column":0,"columnSpan":2,"backgroundColor":"#BD4054"},{"id":"eject","type":"button","label":"EJECT ⏏","command":"Eject","row":0,"column":2,"columnSpan":2},{"id":"prev","type":"button","label":"⏮","command":"Previous","row":1,"column":0},{"id":"play","type":"button","label":"▶","command":"Play","row":1,"column":1},{"id":"pause","type":"button","label":"Ⅱ","command":"Pause","row":1,"column":2},{"id":"next","type":"button","label":"⏭","command":"Next","row":1,"column":3},{"id":"rew","type":"button","label":"⏪","command":"Rewind","row":2,"column":0},{"id":"stop","type":"button","label":"■","command":"Stop","row":2,"column":1,"columnSpan":2},{"id":"ff","type":"button","label":"⏩","command":"FastForward","row":2,"column":3}]},{"id":"program","name":"Program","order":20,"columnSpan":4,"controls":[{"id":"repeat","type":"button","label":"REPEAT","command":"Repeat","row":0,"column":0,"columnSpan":2},{"id":"shuffle","type":"button","label":"SHUFFLE","command":"Shuffle","row":0,"column":2,"columnSpan":2},{"id":"program","type":"button","label":"PROGRAM","command":"Program","row":1,"column":0,"columnSpan":2},{"id":"display","type":"button","label":"DISPLAY","command":"Display","row":1,"column":2,"columnSpan":2}]}]}