{"$schema":"../schemas/device-ui-template-v2.schema.json","schemaVersion":2,"id":"ir-streaming-device-premium-modern","name":"Modern Streaming Remote","deviceTypeId":"streaming-device","connections":["infrared"],"renderer":"declarative","access":"premium","columns":4,"useFullWidth":true,"horizontalSpacing":8,"verticalSpacing":10,"backgroundMode":"vertical-gradient","backgroundColor":"#080E10","backgroundColor2":"#10201E","foregroundColor":"#F4FFFC","accentColor":"#32D5A4","buttonColor":"#18312D","buttonTextColor":"#F4FFFC","borderColor":"#28554C","buttonCornerRadius":20,"buttonHeight":56,"groups":[{"id":"top","name":"Streaming","titlePlacement":"border","order":10,"columnSpan":4,"backgroundColor":"#102722","cornerRadius":22,"controls":[{"type":"button","label":"POWER","command":"Power","row":0,"column":0,"backgroundColor":"#C13F50"},{"type":"button","label":"HOME","command":"Home","row":0,"column":1,"columnSpan":2,"backgroundColor":"#147D63","fontAttribute":"bold"},{"type":"button","label":"BACK","command":"Back","row":0,"column":3}]},{"id":"nav","name":"Navigation","titlePlacement":"border","order":20,"columnSpan":4,"backgroundColor":"#102722","cornerRadius":24,"controls":[{"type":"button","label":"▲","command":"Up","row":0,"column":1,"columnSpan":2,"fontSize":23},{"type":"button","label":"◀","command":"Left","row":1,"column":0,"fontSize":23},{"type":"button","label":"OK","command":"Ok","row":1,"column":1,"columnSpan":2,"backgroundColor":"#159A77","fontAttribute":"bold","fontSize":18},{"type":"button","label":"▶","command":"Right","row":1,"column":3,"fontSize":23},{"type":"button","label":"MENU","command":"Menu","row":2,"column":0},{"type":"button","label":"▼","command":"Down","row":2,"column":1,"columnSpan":2,"fontSize":23},{"type":"button","label":"INFO","command":"Info","row":2,"column":3}]},{"id":"playback","name":"Playback","titlePlacement":"border","order":30,"columnSpan":4,"backgroundColor":"#0E211D","cornerRadius":20,"controls":[{"type":"button","label":"⏪","command":"Rewind","row":0,"column":0,"fontSize":20},{"type":"button","label":"▶ PLAY","command":"Play","row":0,"column":1,"backgroundColor":"#17684E"},{"type":"button","label":"Ⅱ PAUSE","command":"Pause","row":0,"column":2,"backgroundColor":"#6D5720"},{"type":"button","label":"⏩","command":"FastForward","row":0,"column":3,"fontSize":20}]},{"id":"tv","name":"TV Controls","titlePlacement":"border","order":40,"columnSpan":4,"backgroundColor":"#0E211D","cornerRadius":18,"controls":[{"type":"button","label":"VOL +","command":"VolumeUp","row":0,"column":0},{"type":"button","label":"MUTE","command":"Mute","row":0,"column":1,"columnSpan":2},{"type":"button","label":"VOL −","command":"VolumeDown","row":0,"column":3}]}]}