{"$schema":"../schemas/device-ui-template-v2.schema.json","schemaVersion":2,"id":"ir-toys-premium-modern","name":"Modern Toy Remote","deviceTypeId":"toys","connections":["infrared"],"renderer":"declarative","access":"premium","columns":4,"useFullWidth":true,"backgroundMode":"vertical-gradient","backgroundColor":"#100B18","backgroundColor2":"#2D1E42","foregroundColor":"#FFF8FF","surfaceColor":"#35234A","accentColor":"#E38BFF","buttonColor":"#49305F","buttonTextColor":"#FFFFFF","borderColor":"#74508B","buttonCornerRadius":20,"sectionCornerRadius":24,"buttonHeight":58,"groups":[{"id":"toy","name":"Toy Control","order":10,"columnSpan":4,"controls":[{"id":"power","type":"button","label":"POWER","command":"Power","row":0,"column":0,"columnSpan":2},{"id":"demo","type":"button","label":"DEMO","command":"Demo","row":0,"column":2,"columnSpan":2,"backgroundColor":"#7B4A9B"},{"id":"up","type":"button","label":"▲","command":"Up","row":1,"column":1,"columnSpan":2,"fontSize":22},{"id":"left","type":"button","label":"◀","command":"Left","row":2,"column":0,"fontSize":22},{"id":"action","type":"button","label":"ACTION","command":"Action","row":2,"column":1,"columnSpan":2,"backgroundColor":"#9B4D83"},{"id":"right","type":"button","label":"▶","command":"Right","row":2,"column":3,"fontSize":22},{"id":"down","type":"button","label":"▼","command":"Down","row":3,"column":1,"columnSpan":2,"fontSize":22}]},{"id":"fun","name":"Effects","order":20,"columnSpan":4,"controls":[{"id":"sound","type":"button","label":"SOUND","command":"Sound","row":0,"column":0},{"id":"light","type":"button","label":"LIGHT","command":"Light","row":0,"column":1},{"id":"program","type":"button","label":"PROGRAM","command":"Program","row":0,"column":2},{"id":"stop","type":"button","label":"STOP","command":"Stop","row":0,"column":3,"backgroundColor":"#A33E4D"},{"id":"speed-down","type":"button","label":"SPEED −","command":"SpeedDown","row":1,"column":0,"columnSpan":2},{"id":"speed-up","type":"button","label":"SPEED +","command":"SpeedUp","row":1,"column":2,"columnSpan":2}]}]}