{"$schema":"../schemas/device-ui-template-v2.schema.json","schemaVersion":2,"id":"ir-tv-tuner-premium-modern","name":"Modern TV Tuner Remote","deviceTypeId":"tv-tuner","connections":["infrared"],"renderer":"declarative","access":"premium","columns":4,"useFullWidth":true,"backgroundMode":"vertical-gradient","backgroundColor":"#071018","backgroundColor2":"#152A3E","foregroundColor":"#F5FAFF","surfaceColor":"#172F46","accentColor":"#58A8F0","buttonColor":"#203D58","buttonTextColor":"#FFFFFF","borderColor":"#386481","buttonCornerRadius":16,"sectionCornerRadius":22,"buttonHeight":52,"groups":[{"id":"tuner","name":"TV Tuner","order":10,"columnSpan":4,"controls":[{"id":"power","type":"button","label":"POWER","command":"Power","row":0,"column":0},{"id":"source","type":"button","label":"SOURCE","command":"Source","row":0,"column":1},{"id":"guide","type":"button","label":"GUIDE","command":"Guide","row":0,"column":2},{"id":"info","type":"button","label":"INFO","command":"Info","row":0,"column":3},{"id":"ch-up","type":"button","label":"CH +","command":"ChannelUp","row":1,"column":0,"columnSpan":2},{"id":"ch-down","type":"button","label":"CH −","command":"ChannelDown","row":1,"column":2,"columnSpan":2}]},{"id":"numbers","name":"Channels","order":20,"columnSpan":4,"controls":[{"id":"n1","type":"button","label":"1","command":"Digit1","row":0,"column":0},{"id":"n2","type":"button","label":"2","command":"Digit2","row":0,"column":1},{"id":"n3","type":"button","label":"3","command":"Digit3","row":0,"column":2},{"id":"n4","type":"button","label":"4","command":"Digit4","row":1,"column":0},{"id":"n5","type":"button","label":"5","command":"Digit5","row":1,"column":1},{"id":"n6","type":"button","label":"6","command":"Digit6","row":1,"column":2},{"id":"n7","type":"button","label":"7","command":"Digit7","row":2,"column":0},{"id":"n8","type":"button","label":"8","command":"Digit8","row":2,"column":1},{"id":"n9","type":"button","label":"9","command":"Digit9","row":2,"column":2},{"id":"n0","type":"button","label":"0","command":"Digit0","row":3,"column":1},{"id":"last","type":"button","label":"LAST","command":"LastChannel","row":3,"column":2}]}]}