{"$schema":"../schemas/device-ui-template-v2.schema.json","schemaVersion":2,"id":"ir-dust-collector-premium-modern","name":"Modern Dust Collector Remote","deviceTypeId":"dust-collector","connections":["infrared"],"renderer":"declarative","access":"premium","columns":4,"useFullWidth":true,"backgroundMode":"vertical-gradient","backgroundColor":"#10110E","backgroundColor2":"#283024","foregroundColor":"#FAFFF7","surfaceColor":"#293328","accentColor":"#A8D67A","buttonColor":"#394638","buttonTextColor":"#FFFFFF","borderColor":"#60745A","buttonCornerRadius":18,"sectionCornerRadius":22,"buttonHeight":58,"groups":[{"id":"main","name":"Dust Collector","order":10,"columnSpan":4,"controls":[{"id":"power","type":"button","label":"POWER","command":"Power","row":0,"column":0,"columnSpan":2,"backgroundColor":"#B3424D"},{"id":"auto","type":"button","label":"AUTO","command":"Auto","row":0,"column":2,"columnSpan":2,"backgroundColor":"#557D43"},{"id":"start","type":"button","label":"START","command":"Start","row":1,"column":0,"columnSpan":2,"backgroundColor":"#3B7B4B"},{"id":"stop","type":"button","label":"STOP","command":"Stop","row":1,"column":2,"columnSpan":2,"backgroundColor":"#8E3E45"}]},{"id":"airflow","name":"Airflow","order":20,"columnSpan":4,"controls":[{"id":"speed-down","type":"button","label":"SPEED −","command":"FanSpeedDown","row":0,"column":0,"columnSpan":2},{"id":"speed-up","type":"button","label":"SPEED +","command":"FanSpeedUp","row":0,"column":2,"columnSpan":2},{"id":"timer","type":"button","label":"TIMER","command":"Timer","row":1,"column":0,"columnSpan":2},{"id":"filter","type":"button","label":"FILTER RESET","command":"FilterReset","row":1,"column":2,"columnSpan":2}]}]}